{
  "id": "TLP-FIX-1",
  "loop_run_id": "42",
  "strategic_brief_id": "SB-FIX-1",
  "strategic_brief_digest": "aaaaaaaaaaaaaaaaaaaaaaaaaaaaaaaaaaaaaaaaaaaaaaaaaaaaaaaaaaaaaaaa",
  "observations": [
    "読了率 12%→31%（EV-201）",
    "比較記事からの回遊が 2 倍"
  ],
  "metrics": [
    {
      "kpi_node": "read_rate",
      "value": 0.31
    }
  ],
  "qualitative_signals": [
    "コメントで『気づかなかった』言及 3 件"
  ],
  "anomalies": [],
  "hypothesis_assessment": {
    "result": "supported",
    "target_hypothesis_ids": [
      "VH-FIX-1"
    ],
    "reason": "損失可視化パートまでの読了が有意に伸びた"
  },
  "causal_interpretation": "問題顕在化の導入が読了動機を作ったと解釈する",
  "alternative_explanations": [
    "季節要因（繁忙期明け）の可能性"
  ],
  "confidence": 0.55,
  "evidence_ids": [
    "EV-201",
    "EV-202"
  ],
  "proposed_revision_targets": [
    "VH-FIX-1"
  ],
  "recommended_next_action": "continue"
}
